{
  "request_id": "example-request-1",
  "correlation_id": "example-correlation-1",
  "state_revision": 42,
  "warnings": [],
  "errors": [],
  "links": {
    "self": "/api/v1/placement/observations"
  },
  "result": {
    "schema_version": "1.0",
    "controller_id": "xinas-node-01",
    "server_epoch": "publisher-epoch-1",
    "source_generation": 120,
    "generated_at": "2026-09-22T12:00:01Z",
    "snapshot_status": "PARTIAL",
    "collection_period_ms": 5000,
    "capabilities": [
      "raid.array_states",
      "raid.member_states",
      "topology.data_log_realtime",
      "identity",
      "filesystem.mounted_rw",
      "export.effective_access",
      "nfs.service",
      "source.freshness"
    ],
    "coverage": [
      {
        "check": "raid.array_states",
        "required": true,
        "status": "EVALUATED"
      },
      {
        "check": "raid.member_states",
        "required": true,
        "status": "EVALUATED"
      },
      {
        "check": "topology.data_log_realtime",
        "required": true,
        "status": "EVALUATED"
      },
      {
        "check": "identity",
        "required": true,
        "status": "EVALUATED"
      },
      {
        "check": "filesystem.mounted_rw",
        "required": true,
        "status": "EVALUATED"
      },
      {
        "check": "export.effective_access",
        "required": true,
        "status": "EVALUATED",
        "details": {
          "source": "etab"
        }
      },
      {
        "check": "nfs.service",
        "required": true,
        "status": "EVALUATED"
      },
      {
        "check": "source.freshness",
        "required": true,
        "status": "EVALUATED"
      },
      {
        "check": "filesystem.integrity",
        "required": false,
        "status": "NOT_IMPLEMENTED",
        "reason": "OUT_OF_MVP"
      },
      {
        "check": "network.path",
        "required": false,
        "status": "NOT_IMPLEMENTED",
        "reason": "OUT_OF_MVP"
      },
      {
        "check": "network.performance",
        "required": false,
        "status": "NOT_IMPLEMENTED",
        "reason": "OUT_OF_MVP"
      }
    ],
    "shares": [
      {
        "share_id": "training-a",
        "incarnation": "training-a:7",
        "export_path": "/mnt/data/training-a",
        "collection_status": "UNKNOWN",
        "observed_at": "2026-09-22T12:00:00Z",
        "evidence_age_ms": 1000,
        "filesystem_ref": "fs:mnt-data.mount",
        "export_ref": "export:mnt-data-training-a",
        "service_ref": "nfs:nfs-server",
        "reason_codes": [
          "DEPENDENCY_FILESYSTEM_UNAVAILABLE"
        ]
      },
      {
        "share_id": "training-b",
        "incarnation": "training-b:7",
        "export_path": "/mnt/data/training-b",
        "collection_status": "UNKNOWN",
        "observed_at": "2026-09-22T12:00:00Z",
        "evidence_age_ms": 1000,
        "filesystem_ref": "fs:mnt-data.mount",
        "export_ref": "export:mnt-data-training-b",
        "service_ref": "nfs:nfs-server",
        "reason_codes": [
          "DEPENDENCY_FILESYSTEM_UNAVAILABLE"
        ]
      },
      {
        "share_id": "training-c",
        "incarnation": "training-c:7",
        "export_path": "/mnt/data2/training-c",
        "collection_status": "UNKNOWN",
        "observed_at": "2026-09-22T12:00:00Z",
        "evidence_age_ms": 1000,
        "filesystem_ref": "fs:mnt-data2.mount",
        "export_ref": "export:mnt-data2-training-c",
        "service_ref": "nfs:nfs-server",
        "reason_codes": [
          "DEPENDENCY_FILESYSTEM_UNAVAILABLE"
        ]
      }
    ],
    "resources": [
      {
        "id": "array:unavailable",
        "incarnation": "-",
        "collection_status": "ERROR",
        "observed_at": null,
        "evidence_age_ms": null,
        "reason_codes": [
          "XIRAID_DAEMON_UNAVAILABLE"
        ],
        "details": {
          "kind": "ARRAY"
        }
      },
      {
        "id": "fs:mnt-data.mount",
        "incarnation": "fs-uuid-01:/dev/xi_data1",
        "collection_status": "UNKNOWN",
        "observed_at": "2026-09-22T12:00:00Z",
        "evidence_age_ms": 1000,
        "reason_codes": [
          "DEPENDENCY_ARRAY_UNAVAILABLE"
        ],
        "details": {
          "kind": "FILESYSTEM",
          "uuid": "fs-uuid-01",
          "incarnation": "fs-uuid-01:/dev/xi_data1",
          "mountpoint": "/mnt/data",
          "source_device": "/dev/xi_data1",
          "fs_type": "xfs",
          "mounted": true,
          "writable": true,
          "mount_options": [
            "rw",
            "noatime"
          ],
          "super_options": [
            "rw",
            "logdev=/dev/xi_log1"
          ],
          "external_dependencies_resolved": true,
          "array_refs": [
            {
              "role": "DATA",
              "resource_id": "array:data1"
            },
            {
              "role": "LOG",
              "resource_id": "array:log1"
            }
          ],
          "log_mode": "EXTERNAL"
        }
      },
      {
        "id": "fs:mnt-data2.mount",
        "incarnation": "fs-uuid-02:/dev/xi_data2",
        "collection_status": "UNKNOWN",
        "observed_at": "2026-09-22T12:00:00Z",
        "evidence_age_ms": 1000,
        "reason_codes": [
          "DEPENDENCY_ARRAY_UNAVAILABLE"
        ],
        "details": {
          "kind": "FILESYSTEM",
          "uuid": "fs-uuid-02",
          "incarnation": "fs-uuid-02:/dev/xi_data2",
          "mountpoint": "/mnt/data2",
          "source_device": "/dev/xi_data2",
          "fs_type": "xfs",
          "mounted": true,
          "writable": true,
          "mount_options": [
            "rw",
            "noatime"
          ],
          "super_options": [
            "rw",
            "logdev=/dev/xi_log2"
          ],
          "external_dependencies_resolved": true,
          "array_refs": [
            {
              "role": "DATA",
              "resource_id": "array:data2"
            },
            {
              "role": "LOG",
              "resource_id": "array:log2"
            }
          ],
          "log_mode": "EXTERNAL"
        }
      },
      {
        "id": "export:mnt-data-training-a",
        "incarnation": "export:mnt-data-training-a:7",
        "collection_status": "SUCCESS",
        "observed_at": "2026-09-22T12:00:00Z",
        "evidence_age_ms": 1000,
        "reason_codes": [],
        "details": {
          "kind": "EXPORT",
          "export_path": "/mnt/data/training-a",
          "present": true,
          "source": "etab",
          "rules": [
            {
              "client": "10.10.0.0/16",
              "writable": true,
              "security": [
                "sys"
              ],
              "options": [
                "rw",
                "sync",
                "no_subtree_check",
                "fsid=7"
              ]
            }
          ]
        }
      },
      {
        "id": "export:mnt-data-training-b",
        "incarnation": "export:mnt-data-training-b:7",
        "collection_status": "SUCCESS",
        "observed_at": "2026-09-22T12:00:00Z",
        "evidence_age_ms": 1000,
        "reason_codes": [],
        "details": {
          "kind": "EXPORT",
          "export_path": "/mnt/data/training-b",
          "present": true,
          "source": "etab",
          "rules": [
            {
              "client": "10.10.0.0/16",
              "writable": true,
              "security": [
                "sys"
              ],
              "options": [
                "rw",
                "sync",
                "no_subtree_check",
                "fsid=7"
              ]
            }
          ]
        }
      },
      {
        "id": "export:mnt-data2-training-c",
        "incarnation": "export:mnt-data2-training-c:7",
        "collection_status": "SUCCESS",
        "observed_at": "2026-09-22T12:00:00Z",
        "evidence_age_ms": 1000,
        "reason_codes": [],
        "details": {
          "kind": "EXPORT",
          "export_path": "/mnt/data2/training-c",
          "present": true,
          "source": "etab",
          "rules": [
            {
              "client": "10.10.0.0/16",
              "writable": true,
              "security": [
                "sys"
              ],
              "options": [
                "rw",
                "sync",
                "no_subtree_check",
                "fsid=7"
              ]
            }
          ]
        }
      },
      {
        "id": "nfs:nfs-server",
        "incarnation": "nfs:nfs-server:active",
        "collection_status": "SUCCESS",
        "observed_at": "2026-09-22T12:00:00Z",
        "evidence_age_ms": 1100,
        "reason_codes": [],
        "details": {
          "kind": "NFS_SERVICE",
          "running": true,
          "protocols": [
            "NFSv3",
            "NFSv4.1",
            "NFSv4.2"
          ],
          "reason_codes": [],
          "unit_active_state": "active",
          "threads": 8
        }
      }
    ]
  }
}
